{
  "$schema": "https://json-schema.org/draft/2020-12/schema",
  "$id": "https://github.com/agentpatternscatalog/patterns/composition-candidates.schema.json",
  "title": "Composition Candidates To Add",
  "description": "Tracks new compositions (frameworks, services, protocols, applications) surfaced during scans or pattern authoring but not yet catalogued in compositions-src/. The symmetric analog of pattern-todo.json for the composition layer. Distinct from compositions-todo.json, which is a pattern-centric usage-coverage worklist (which existing patterns lack a documented usage). Each entry names a candidate composition, the patterns it would implement, and the upstream evidence. Entries graduate by being authored into compositions-src/ and removed from this list.",
  "type": "object",
  "additionalProperties": false,
  "required": ["last_updated", "candidates"],
  "properties": {
    "$schema": {"type": "string"},
    "title": {"type": "string"},
    "description": {"type": "string"},
    "last_updated": {"type": "string", "format": "date"},
    "candidates": {
      "type": "array",
      "items": {"$ref": "#/$defs/candidate"}
    }
  },
  "$defs": {
    "candidate": {
      "type": "object",
      "additionalProperties": false,
      "required": ["id", "name", "raised_by", "status"],
      "properties": {
        "id": {
          "type": "string",
          "pattern": "^[a-z0-9][a-z0-9-]*$",
          "description": "Proposed kebab-case composition id. Must not collide with any existing composition id in compositions-src/."
        },
        "name": {
          "type": "string",
          "description": "Proposed human-readable name."
        },
        "kind_hint": {
          "type": "string",
          "enum": ["recipe", "framework"],
          "description": "Whether this candidate is a recipe (a reusable pattern arrangement) or a framework/product/service/protocol."
        },
        "category_hint": {
          "type": "string",
          "description": "Suggested composition category (e.g. orchestration-framework, voice-conversational, agent-sdk). Optional — authoring may re-classify."
        },
        "summary": {
          "type": "string",
          "description": "One or two sentences naming what the composition is and what it does."
        },
        "suggested_members": {
          "type": "array",
          "description": "Catalog patterns this composition is expected to implement, with optional role and note. These become members[] when authored.",
          "items": {
            "type": "object",
            "additionalProperties": false,
            "required": ["pattern"],
            "properties": {
              "pattern": {"type": "string", "description": "Existing or proposed pattern id this composition would implement."},
              "role": {"type": "string", "enum": ["core", "first-class", "supported", "limited", "via-integration", "opt-in", "anti-pattern", "unknown"]},
              "note": {"type": "string"}
            }
          }
        },
        "raised_by": {
          "type": "array",
          "minItems": 1,
          "description": "What surfaced this candidate, and the upstream evidence. The source is the pattern id whose known_uses/references named it, or 'global-scan' when the wider literature surfaced it.",
          "items": {
            "type": "object",
            "additionalProperties": false,
            "required": ["source"],
            "properties": {
              "source": {
                "type": "string",
                "description": "Pattern id that referenced this composition, or 'global-scan' for literature-surfaced candidates."
              },
              "note": {"type": "string"},
              "evidence": {
                "type": "array",
                "items": {"$ref": "#/$defs/evidence"}
              }
            }
          }
        },
        "status": {
          "type": "string",
          "enum": ["proposed", "drafting", "authored", "rejected"],
          "description": "Lifecycle: proposed = on the list; drafting = entry being written in compositions-src/; authored = lives in compositions-src/ now (this candidate can be deleted); rejected = considered and not pursued, with a reason."
        },
        "rejected_reason": {
          "type": "string",
          "description": "When status=rejected, why."
        },
        "needs_verification": {
          "type": "boolean",
          "description": "True when the candidate was surfaced from a secondary mention and its own primary source has not yet been content-verified. Must be resolved to false (with a content-verified primary source) before authoring."
        },
        "first_raised": {"type": "string", "format": "date"},
        "last_touched": {"type": "string", "format": "date"}
      }
    },
    "evidence": {
      "type": "object",
      "additionalProperties": false,
      "required": ["type", "url"],
      "properties": {
        "type": {
          "type": "string",
          "enum": ["doc", "repo", "blog", "paper", "talk", "spec", "changelog", "issue", "tutorial", "api-ref"]
        },
        "title": {"type": "string"},
        "url": {"type": "string", "format": "uri"},
        "quote": {"type": "string"},
        "accessed": {"type": "string", "format": "date"}
      }
    }
  }
}
