{
  "$schema": "./composition-candidates.schema.json",
  "title": "Composition Candidates To Add",
  "description": "New compositions (frameworks, services, protocols, applications) surfaced during scans or pattern authoring but not yet catalogued in compositions-src/. The symmetric analog of pattern-todo.json for the composition layer. Distinct from compositions-todo.json (a pattern-centric usage-coverage worklist). Each entry names a candidate composition, the patterns it would implement, and the upstream evidence with a verifiable url and verbatim quote. needs_verification:true means the candidate was surfaced from a secondary mention and must have its own primary source content-verified before authoring. Entries graduate by being authored into compositions-src/ and removed from this list.",
  "last_updated": "2026-07-16",
  "candidates": [
    {
      "id": "verl",
      "name": "verl (Volcano Engine Reinforcement Learning for LLMs)",
      "kind_hint": "framework",
      "category_hint": "orchestration-framework",
      "summary": "ByteDance's open-source RL post-training library for LLMs and the de-facto substrate for agentic RL: multi-turn rollouts with tool calling, agent loops, PPO/GRPO/GSPO/DAPO/PRIME, vLLM/SGLang rollout engines against FSDP/Megatron training engines, and an explicit 'zero-mismatch' rollout path built on batch-invariant kernels. Wave 1 claimed OpenEnv, verifiers and the Prime Intellect Environments Hub (the environment side); verl is the training-loop side of the same stack and is not yet claimed.",
      "suggested_members": [
        {
          "pattern": "process-reward-model"
        },
        {
          "pattern": "best-of-n"
        },
        {
          "pattern": "rest-em"
        },
        {
          "pattern": "eval-harness"
        }
      ],
      "raised_by": [
        {
          "source": "global-scan",
          "evidence": [
            {
              "type": "repo",
              "title": "volcengine/verl",
              "url": "https://github.com/volcengine/verl",
              "quote": "verl is a flexible, efficient and production-ready RL training library for large language models (LLMs).",
              "accessed": "2026-09-04"
            },
            {
              "type": "repo",
              "title": "volcengine/verl — training/inference alignment",
              "url": "https://github.com/volcengine/verl",
              "quote": "zero-mismatch HuggingFace rollout vexact",
              "accessed": "2026-09-04"
            }
          ]
        }
      ],
      "status": "proposed",
      "needs_verification": true
    },
    {
      "id": "chess-sql-synthesis",
      "name": "CHESS",
      "kind_hint": "framework",
      "category_hint": "domain-agent",
      "summary": "A four-agent text-to-SQL framework (Information Retriever, Schema Selector, Candidate Generator, Unit Tester) that decomposes NL-to-SQL over enterprise-scale catalogs into value retrieval, schema pruning, iterative candidate generation, and LLM-written natural-language unit tests over the generated query.",
      "suggested_members": [
        {
          "pattern": "table-augmented-generation"
        },
        {
          "pattern": "canonical-entity-grounding"
        },
        {
          "pattern": "best-of-n"
        },
        {
          "pattern": "generate-and-test-strategy"
        },
        {
          "pattern": "llm-as-judge"
        }
      ],
      "raised_by": [
        {
          "source": "global-scan",
          "evidence": [
            {
              "type": "paper",
              "title": "CHESS: Contextual Harnessing for Efficient SQL Synthesis",
              "url": "https://arxiv.org/abs/2405.16755",
              "quote": "We introduce CHESS, a Large Language Model (LLM) based multi-agent framework for efficient and scalable SQL synthesis, comprising four specialized agents, each targeting one of the aforementioned challenges: the Information Retriever (IR) extracts relevant data, the Schema Selector (SS) prunes large schemas, the Candidate Generator (CG) generates high-quality candidates and refines queries iteratively, and the Unit Tester (UT) validates queries through LLM-based natural language unit tests.",
              "accessed": "2026-09-04"
            }
          ]
        }
      ],
      "status": "proposed",
      "needs_verification": true
    },
    {
      "id": "hal-holistic-agent-leaderboard",
      "name": "HAL (Holistic Agent Leaderboard)",
      "kind_hint": "framework",
      "category_hint": "orchestration-framework",
      "summary": "Standardized agent-evaluation infrastructure from the Princeton/Stanford group behind 'AI Agents That Matter': a parallel evaluation harness across hundreds of VMs, three-dimensional analysis over models x scaffolds x benchmarks, per-run cost accounting, and LLM-aided log inspection that surfaced agents searching for the benchmark on HuggingFace instead of solving the task. Catalog already has inspect-ai, braintrust, langsmith, arize-phoenix, langfuse, promptfoo, ragas and deepeval, but no leaderboard-grade agent harness that treats cost and log auditing as first-class.",
      "suggested_members": [
        {
          "pattern": "eval-harness"
        },
        {
          "pattern": "accuracy-cost-pareto-eval"
        },
        {
          "pattern": "search-sealed-eval-set"
        },
        {
          "pattern": "score-validity-envelope"
        },
        {
          "pattern": "agent-as-judge"
        },
        {
          "pattern": "sampled-prompt-trace-eval"
        },
        {
          "pattern": "cost-observability"
        }
      ],
      "raised_by": [
        {
          "source": "global-scan",
          "evidence": [
            {
              "type": "paper",
              "title": "Holistic Agent Leaderboard: The Missing Infrastructure for AI Agent Evaluation",
              "url": "https://arxiv.org/abs/2510.11977",
              "quote": "First, we provide a standardized evaluation harness that orchestrates parallel evaluations across hundreds of VMs, reducing evaluation time from weeks to hours while eliminating common implementation bugs.",
              "accessed": "2026-09-04"
            },
            {
              "type": "paper",
              "title": "Holistic Agent Leaderboard: The Missing Infrastructure for AI Agent Evaluation",
              "url": "https://arxiv.org/abs/2510.11977",
              "quote": "We validate the harness by conducting 21,730 agent rollouts across 9 models and 9 benchmarks in coding, web navigation, science, and customer service with a total cost of about $40,000.",
              "accessed": "2026-09-04"
            }
          ]
        }
      ],
      "status": "proposed",
      "needs_verification": true
    },
    {
      "id": "e2b",
      "name": "E2B",
      "kind_hint": "framework",
      "category_hint": "agent-sdk",
      "summary": "Hosted sandbox runtime and SDK for running agent-generated code, with per-sandbox isolation and pause/resume of the full filesystem-and-memory state (roughly one second to resume), used as the execution environment beneath coding and data agents.",
      "suggested_members": [
        {
          "pattern": "sandbox-isolation"
        },
        {
          "pattern": "code-execution"
        },
        {
          "pattern": "session-isolation"
        },
        {
          "pattern": "subagent-isolation"
        },
        {
          "pattern": "secrets-handling"
        }
      ],
      "raised_by": [
        {
          "source": "global-scan",
          "evidence": [
            {
              "type": "doc",
              "title": "Sandbox persistence — E2B docs",
              "url": "https://docs.e2b.dev/sandbox/persistence",
              "quote": "both the sandbox's filesystem and memory state will be saved",
              "accessed": "2026-09-04"
            },
            {
              "type": "doc",
              "title": "Sandbox persistence — E2B docs (resume latency)",
              "url": "https://docs.e2b.dev/sandbox/persistence",
              "quote": "Resuming a sandbox takes approximately 1 second",
              "accessed": "2026-09-04"
            }
          ]
        }
      ],
      "status": "proposed",
      "needs_verification": true
    },
    {
      "id": "agentuniverse",
      "name": "agentUniverse (Ant Group)",
      "kind_hint": "framework",
      "category_hint": "orchestration-framework",
      "summary": "Ant Group's open-source multi-agent framework, grown out of its own financial-services practice, whose distinguishing feature is a 'collaborative pattern factory' shipping named, reusable multi-agent collaboration patterns — PEER (Plan / Execute / Express / Review) and DOE (Data-fining / Opinion-inject / Express) — rather than leaving topology to the application author. PEER has its own peer-reviewed write-up with a financial-QA evaluation.",
      "suggested_members": [
        {
          "pattern": "plan-and-execute"
        },
        {
          "pattern": "role-assignment"
        },
        {
          "pattern": "reflection"
        },
        {
          "pattern": "chat-chain"
        },
        {
          "pattern": "agentic-rag"
        },
        {
          "pattern": "sop-encoded-multi-agent"
        }
      ],
      "raised_by": [
        {
          "source": "global-scan",
          "evidence": [
            {
              "type": "repo",
              "title": "agentUniverse — GitHub (agentuniverse-ai/agentUniverse)",
              "url": "https://github.com/agentuniverse-ai/agentUniverse",
              "quote": "agentUniverse originates from the real-world financial business practices of AntGroup, dedicated to assisting developers and enterprises in effortlessly constructing domain-expert-level intelligent agents.",
              "accessed": "2026-09-04"
            },
            {
              "type": "repo",